{
  "$schema": "https://human-writing-rules.example/schemas/generated-registry-index.schema.json",
  "counts": {
    "formats": 2,
    "languages": 2,
    "objects": 60,
    "platforms": 11,
    "rfcs": 6,
    "skills": 5,
    "tones": 8,
    "topics": 11
  },
  "defaults": {
    "topic_fallback": "general"
  },
  "objects": {
    "core.content-model": {
      "kind": "core",
      "path": "core/content-model.md",
      "requires": [],
      "status": "active",
      "tags": [
        "required",
        "resolution"
      ],
      "title": "Content Model"
    },
    "core.context-selection": {
      "kind": "core",
      "path": "core/context-selection.md",
      "requires": [
        "core.content-model"
      ],
      "status": "active",
      "tags": [
        "required",
        "resolution"
      ],
      "title": "Selective Context Loading"
    },
    "core.writing-pipeline": {
      "kind": "core",
      "path": "core/writing-pipeline.md",
      "requires": [
        "core.content-model",
        "core.context-selection",
        "principle.audience-before-format",
        "principle.facts-before-fluency",
        "principle.meaning-before-engagement",
        "principle.native-not-translated",
        "principle.revision-with-purpose"
      ],
      "status": "active",
      "tags": [
        "required"
      ],
      "title": "Writing Pipeline"
    },
    "format.article.foundation": {
      "kind": "format",
      "path": "rules/format/article/foundation.md",
      "requires": [
        "core.writing-pipeline",
        "rule.source-integrity",
        "rule.human-signals.core",
        "rule.style.no-template-pressure"
      ],
      "selectors": {
        "formats": [
          "article"
        ]
      },
      "status": "active",
      "tags": [
        "format",
        "long-form"
      ],
      "title": "Article Format"
    },
    "format.social-post.foundation": {
      "kind": "format",
      "path": "rules/format/social-post/foundation.md",
      "requires": [
        "core.writing-pipeline",
        "rule.source-integrity",
        "rule.human-signals.core",
        "rule.style.no-template-pressure"
      ],
      "selectors": {
        "formats": [
          "social-post"
        ]
      },
      "status": "active",
      "tags": [
        "format",
        "short-form"
      ],
      "title": "Social Post Format"
    },
    "language.en.foundation": {
      "kind": "language",
      "path": "rules/language/en/foundation.md",
      "requires": [
        "rule.human-signals.core"
      ],
      "selectors": {
        "languages": [
          "en"
        ]
      },
      "status": "active",
      "tags": [
        "language"
      ],
      "title": "English Foundation"
    },
    "language.ru.foundation": {
      "kind": "language",
      "path": "rules/language/ru/foundation.md",
      "requires": [
        "rule.human-signals.core"
      ],
      "selectors": {
        "languages": [
          "ru"
        ]
      },
      "status": "active",
      "tags": [
        "language"
      ],
      "title": "Russian Foundation"
    },
    "platform.blog.foundation": {
      "kind": "platform",
      "path": "rules/platform/blog/foundation.md",
      "requires": [
        "core.writing-pipeline"
      ],
      "selectors": {
        "formats": [
          "article"
        ],
        "platforms": [
          "blog"
        ]
      },
      "status": "active",
      "tags": [
        "platform",
        "blog"
      ],
      "title": "Generic Blog"
    },
    "platform.devto.foundation": {
      "kind": "platform",
      "path": "rules/platform/devto/foundation.md",
      "requires": [
        "platform.blog.foundation"
      ],
      "selectors": {
        "formats": [
          "article"
        ],
        "platforms": [
          "devto"
        ]
      },
      "status": "active",
      "tags": [
        "platform",
        "blog",
        "developer"
      ],
      "title": "DEV Community"
    },
    "platform.dzen.foundation": {
      "kind": "platform",
      "path": "rules/platform/dzen/foundation.md",
      "requires": [
        "platform.blog.foundation"
      ],
      "selectors": {
        "formats": [
          "article"
        ],
        "platforms": [
          "dzen"
        ]
      },
      "status": "active",
      "tags": [
        "platform",
        "blog"
      ],
      "title": "Dzen"
    },
    "platform.github.foundation": {
      "kind": "platform",
      "path": "rules/platform/github/foundation.md",
      "requires": [
        "platform.blog.foundation"
      ],
      "selectors": {
        "formats": [
          "article"
        ],
        "platforms": [
          "github"
        ]
      },
      "status": "active",
      "tags": [
        "platform",
        "blog",
        "developer"
      ],
      "title": "GitHub"
    },
    "platform.habr.foundation": {
      "kind": "platform",
      "path": "rules/platform/habr/foundation.md",
      "requires": [
        "platform.blog.foundation"
      ],
      "selectors": {
        "formats": [
          "article"
        ],
        "platforms": [
          "habr"
        ]
      },
      "status": "active",
      "tags": [
        "platform",
        "blog"
      ],
      "title": "Habr"
    },
    "platform.linkedin.foundation": {
      "kind": "platform",
      "path": "rules/platform/linkedin/foundation.md",
      "requires": [
        "platform.social.foundation"
      ],
      "selectors": {
        "formats": [
          "social-post"
        ],
        "platforms": [
          "linkedin"
        ]
      },
      "status": "active",
      "tags": [
        "platform",
        "social"
      ],
      "title": "LinkedIn"
    },
    "platform.newsletter.foundation": {
      "kind": "platform",
      "path": "rules/platform/newsletter/foundation.md",
      "requires": [
        "platform.blog.foundation"
      ],
      "selectors": {
        "formats": [
          "article"
        ],
        "platforms": [
          "newsletter"
        ]
      },
      "status": "active",
      "tags": [
        "platform",
        "blog",
        "email"
      ],
      "title": "Newsletter"
    },
    "platform.setka.foundation": {
      "kind": "platform",
      "path": "rules/platform/setka/foundation.md",
      "requires": [
        "platform.blog.foundation"
      ],
      "selectors": {
        "formats": [
          "article"
        ],
        "platforms": [
          "setka"
        ]
      },
      "status": "active",
      "tags": [
        "platform",
        "blog"
      ],
      "title": "Setka"
    },
    "platform.social.foundation": {
      "kind": "platform",
      "path": "rules/platform/social/foundation.md",
      "requires": [
        "core.writing-pipeline"
      ],
      "selectors": {
        "formats": [
          "social-post"
        ],
        "platforms": [
          "social"
        ]
      },
      "status": "active",
      "tags": [
        "platform",
        "social"
      ],
      "title": "Generic Social Platform"
    },
    "platform.telegram.foundation": {
      "kind": "platform",
      "path": "rules/platform/telegram/foundation.md",
      "requires": [
        "platform.social.foundation"
      ],
      "selectors": {
        "formats": [
          "social-post"
        ],
        "platforms": [
          "telegram"
        ]
      },
      "status": "active",
      "tags": [
        "platform",
        "social"
      ],
      "title": "Telegram"
    },
    "platform.vc.foundation": {
      "kind": "platform",
      "path": "rules/platform/vc/foundation.md",
      "requires": [
        "platform.blog.foundation"
      ],
      "selectors": {
        "formats": [
          "article"
        ],
        "platforms": [
          "vc"
        ]
      },
      "status": "active",
      "tags": [
        "platform",
        "blog",
        "business"
      ],
      "title": "vc.ru"
    },
    "principle.audience-before-format": {
      "kind": "principle",
      "path": "principles/audience-before-format.md",
      "requires": [],
      "status": "active",
      "tags": [
        "principle"
      ],
      "title": "Audience Before Format"
    },
    "principle.facts-before-fluency": {
      "kind": "principle",
      "path": "principles/facts-before-fluency.md",
      "requires": [],
      "status": "active",
      "tags": [
        "principle"
      ],
      "title": "Facts Before Fluency"
    },
    "principle.meaning-before-engagement": {
      "kind": "principle",
      "path": "principles/meaning-before-engagement.md",
      "requires": [],
      "status": "active",
      "tags": [
        "principle"
      ],
      "title": "Meaning Before Engagement"
    },
    "principle.native-not-translated": {
      "kind": "principle",
      "path": "principles/native-not-translated.md",
      "requires": [],
      "status": "active",
      "tags": [
        "principle"
      ],
      "title": "Native Not Translated"
    },
    "principle.revision-with-purpose": {
      "kind": "principle",
      "path": "principles/revision-with-purpose.md",
      "requires": [],
      "status": "active",
      "tags": [
        "principle"
      ],
      "title": "Revision With Purpose"
    },
    "reviewer.editor": {
      "kind": "reviewer",
      "path": "reviewers/editor.md",
      "requires": [
        "core.writing-pipeline"
      ],
      "status": "active",
      "tags": [
        "reviewer",
        "required"
      ],
      "title": "Editor"
    },
    "reviewer.format": {
      "kind": "reviewer",
      "path": "reviewers/format.md",
      "requires": [
        "core.writing-pipeline"
      ],
      "status": "active",
      "tags": [
        "reviewer",
        "format"
      ],
      "title": "Format Reviewer"
    },
    "reviewer.human-signals": {
      "kind": "reviewer",
      "path": "reviewers/human-signals.md",
      "requires": [
        "rule.human-signals.core"
      ],